{
  "schemaVersion": "drama-studio/remote-receipt/v0",
  "operation": "save_story_artifact",
  "requestId": "d1-probe-save-long-1.resend-1",
  "inputFingerprint": "sha256:358dfee0b723a2616ba70b1c1d360ae6f171d99fe8bd163d09c687a5d997df43",
  "remote": {
    "projectId": "4e6556ac97654bf781977",
    "artifactId": "282a6bf6-7a7b-4636-afc0-728cc06f9b26",
    "revision": 1,
    "inputSnapshotId": "sha256:9be0b1334077ad7e1332d825fd08104054c31f4aa4ddf273c1234f5f2521d390"
  },
  "outcome": "confirmed",
  "retryAllowed": false,
  "observedAt": "2026-10-05T17:29:29+08:00",
  "evidence": "saved response 08-save-long.resend.response.json: mali-tool-result/v1; ok; HTTP 200",
  "localRef": {
    "kind": "remote_receipt",
    "id": "d1-probe-save-long-1",
    "revision": null
  },
  "notes": "{\"kind\": \"research\", \"episodeRef\": null, \"expectedRevision\": 0, \"slotCheck\": \"record.slot matched --input slot (S)\", \"reconciles\": \"d1-probe-save-long-1\", \"check\": \"identical re-send; inputFingerprint and record.requestId matched (S)\", \"observedRequestId\": \"d1-probe-save-long-1\"}"
}
