{
  "schemaVersion": "drama-studio/remote-receipt/v0",
  "operation": "get_story_artifact",
  "requestId": "d1-probe-get-1",
  "inputFingerprint": "sha256:744be32f963d227e47b9d2e761f3b4b4b229054e66a5b3608027a4347b1ef156",
  "remote": {
    "projectId": "4e6556ac97654bf781977",
    "artifactId": "5da998a0-b9c6-47ae-9635-ee08410bc0fc",
    "revision": 1,
    "inputSnapshotId": "sha256:9be0b1334077ad7e1332d825fd08104054c31f4aa4ddf273c1234f5f2521d390"
  },
  "outcome": "confirmed",
  "retryAllowed": false,
  "observedAt": "2026-10-05T17:29:28+08:00",
  "evidence": "saved response 03-get.response.json: mali-tool-result/v1; ok; HTTP 200"
}
