{
  "schemaVersion": "drama-studio/remote-receipt/v0",
  "operation": "list_story_artifacts",
  "requestId": "d1-list-1",
  "inputFingerprint": "sha256:2f45a9b07e477fea670b0c37b38b7d99b8049ea6c090697f010a587bd685783d",
  "remote": {
    "projectId": "2f70c1e9fad74f35ae27f",
    "artifactId": "071cbe96-1671-4f63-9232-7ddecf234ba3",
    "revision": 1,
    "inputSnapshotId": "sha256:23c10720efd4880fd3b431374bbc44cfd0552ceb18a2be6f7e67aa9b20894225"
  },
  "outcome": "confirmed",
  "observedAt": "2026-09-30T12:29:50+08:00",
  "evidence": "HTTP 200",
  "notes": "local deployment http://localhost:3011 (mali-story main c6aebcf3), not production"
}